### ISSUE TITLE
SNMPD configured as proxy crashes when it gets response from Mikrotik devices

### ISSUE THREAD

**Issue by vasiliev123** [net-snmp/net-snmp#193]
net-snmp version:
Version: 5.72 (CentOS 7 repo rpm net-snmp.x86_64 5.7.2-48.el7_8.1)

OS Version:
CentOS 7 3.10.0-862.9.1.el7.x86_64 #1 SMP Mon Jul 16 16:29:36 UTC 2018 x86_64 x86_64 x86_64 GNU/Linux

Steps to reproduce:
When LibreNMS asks for below OIDs and the device is Mikrotik:
1.3.6.1.4.1.6027.3.26.1.4.4
1.3.6.1.4.1.6876.2.1.1.2.1.2

Or we invoke those commands manually:
snmpwalk -v2c -c rtr-1 rtr-1 1.3.6.1.4.1.6027.3.26.1.4.4
snmpwalk -v2c -c rtr-1 rtr-1 1.3.6.1.4.1.6876.2.1.1.2.1.2

The snmpd which is configured as proxy dies, it doesn't happen when we invoke those commands against for e.g. linux systems, HP Switches, Huawei Switches or even Ubiquiti routers.

SNMPD proxy config for Mikrotik:
# proxy rtr-1
access  notConfigGroup rtr-1        any     noauth  prefix  systemview none none
com2sec -Cn rtr-1 notConfigUser default rtr-1
proxy -Cn rtr-1 -v 2c -c community 192.168.87.252 .1.3

Response from mikrotik on tcpdump for OID 1.3.6.1.4.1.6027.3.26.1.4.4:

tcpdump: verbose output suppressed, use -v or -vv for full protocol decode
listening on any, link-type LINUX_SLL (Linux cooked), capture size 262144 bytes
14:47:43.828778 IP 192.168.0.240.56816 > proxy-system.snmp:  C="rtr-1" GetNextRequest(32)  E:6027.3.26.1.4.4
14:47:43.832546 IP proxy-system.39891 > 192.168.87.252.snmp:  C="community" GetNextRequest(32)  E:6027.3.26.1.4.4
14:47:43.884838 IP 192.168.87.252.snmp > proxy-system.39891:  C="community" GetResponse(51)  E:6876.2.1.1.4.4=[noSuchObject] E:14988.1.1.1.4.0=0

I don't know why Mikrotik responses with wrong OID, E:6876.2.1.1.4.4=[noSuchObject] E:14988.1.1.1.4.0=0 instead of E:6027.3.26.1.4.4=[noSuchObject]

I can assume that mikrotik have a bug. Asking for 1.3.6.1.4.1.6876.2.1.1.2.1.2 OID:
15:04:45.174993 IP proxy-system.46633 > 192.168.87.252.snmp:  C="community" GetNextRequest(33)  E:6876.2.1.1.2.1.2
15:04:45.226648 IP 192.168.87.252.snmp > proxy-system.46633:  C="community" GetResponse(52)  E:6876.2.1.1.2.1.2=[noSuchObject] E:14988.1.1.1.4.0=0

For the record, response from Huawei switch:
tcpdump: verbose output suppressed, use -v or -vv for full protocol decode
listening on any, link-type LINUX_SLL (Linux cooked), capture size 262144 bytes
14:49:17.604741 IP 192.168.0.240.40046 > proxy-system.snmp:  C="sw-1" GetNextRequest(32)  E:6027.3.26.1.4.4
14:49:17.606616 IP proxy-system.36149 > 192.168.87.231.snmp:  C="community" GetNextRequest(32)  E:6027.3.26.1.4.4
14:49:17.614675 IP 192.168.87.231.snmp > proxy-system.36149:  C="community" GetResponse(31)  S:1.1.6.1.0=0
14:49:17.614796 IP proxy-system.snmp > 192.168.0.240.40046:  C="sw-1" GetResponse(31)  S:1.1.6.1.0=0
14:49:17.615035 IP 192.168.0.240.40046 > proxy-system.snmp:  C="sw-1" GetRequest(32)  E:6027.3.26.1.4.4
14:49:17.615145 IP proxy-system.snmp > 192.168.0.240.40046:  C="sw-1" GetResponse(32)  E:6027.3.26.1.4.4=[noSuchObject]

In the attachment file you can see the results in /var/log/messages file
[messages-on-proxy-system.log](https://github.com/net-snmp/net-snmp/files/5327400/messages-on-proxy-system.log)
