### ISSUE TITLE
proxy mode - high cpu usage for OID LLDPv2

### ISSUE THREAD

**Issue by maxilee** [net-snmp/net-snmp#842]
Hi.
I've got problem with proxy on snmpd.

on linux host with snmpd proxy we have got config for net-snmp :

access  notConfigGroup end_point_name        any     noauth  prefix  systemview none none
com2sec -Cn end_point_name notConfigUser default end_point_name
proxy -Cn end_point_name -v 2c -c _community_ 1.2.3.4 .1.3

where end_point_name - is the name of monitored device and community used for proxy
community - this is community of monitored device
1.2.3.4 - this is IP of monitored device

and when do snmpwalk for specific OID from mib LLDPv2 
```
snmpwalk -v2c -c end_point_name end_point_name .1.3.111.2.802.1.1.13.1.4.1
```
process snmpd generates high cpu usage and stuck in some loop.
I've already creates case for libreNSM about that - by they says that problem could be related net-snmp proxy itself.
( https://github.com/librenms/librenms/issues/16294 )

problem can related that on end point device there is no info oboud LLDPv2 - that information cam from endpoint to proxy ,
but proxy still trying to query endpoint about that OID.

this is tcpdump of traffic between endpoint and proxy - after running snmpwalk command.

```
09:49:41.247975 IP 1.2.3.4.snmp > proxy.56459:  GetResponse(31)  .1.3.111.2.802.1.1.13.1.4.1=[endOfMibView]
09:49:41.248402 IP 1.2.3.4.snmp > proxy.56459:  GetResponse(31)  .1.3.111.2.802.1.1.13.1.4.1=[endOfMibView]
09:49:41.248482 IP proxy.56459 > 1.2.3.4.snmp:  GetNextRequest(31)  .1.3.111.2.802.1.1.13.1.4.1
09:49:41.248684 IP proxy.56459 > 1.2.3.4.snmp:  GetNextRequest(31)  .1.3.111.2.802.1.1.13.1.4.1
09:49:41.249470 IP 1.2.3.4.snmp > proxy.56459:  GetResponse(31)  .1.3.111.2.802.1.1.13.1.4.1=[endOfMibView]
09:49:41.249861 IP proxy.56459 > 1.2.3.4.snmp:  GetNextRequest(31)  .1.3.111.2.802.1.1.13.1.4.1
09:49:41.249999 IP 1.2.3.4.snmp > proxy.56459:  GetResponse(31)  .1.3.111.2.802.1.1.13.1.4.1=[endOfMibView]
09:49:41.250180 IP proxy.56459 > 1.2.3.4.snmp:  GetNextRequest(31)  .1.3.111.2.802.1.1.13.1.4.1
09:49:41.250966 IP 1.2.3.4.snmp > proxy.56459:  GetResponse(31)  .1.3.111.2.802.1.1.13.1.4.1=[endOfMibView]
09:49:41.251385 IP 1.2.3.4.snmp > proxy.56459:  GetResponse(31)  .1.3.111.2.802.1.1.13.1.4.1=[endOfMibView]
09:49:41.251438 IP proxy.56459 > 1.2.3.4.snmp:  GetNextRequest(31)  .1.3.111.2.802.1.1.13.1.4.1
09:49:41.251619 IP proxy.56459 > 1.2.3.4.snmp:  GetNextRequest(31)  .1.3.111.2.802.1.1.13.1.4.1
```

when I do snmpwalk direct from monitoring host do endpoint - the answer is correct : 
```
[root@librenms ~]# snmpwalk -v2c -c public 1.2.3.4 .1.3.111.2.802.1.1.13.1.4.1
SNMPv2-SMI::org.111.2.802.1.1.13.1.4.1 = No more variables left in this MIB View (It is past the end of the MIB tree)
```
